timestamp,title,text,score,num_comments,url
2021-11-11 09:16:59,🚀 HOW TO BUY DOGECOIN!! 🚀,"This post is updated for Feb 2024!!


Please make sure you read the entire post[.](https://a.thumbs.redditmedia.com/vb0vfwrVCdHds6ESQaGK38rHgmLtm2Z9QwoDxL9DqP4.png)


Several months ago I asked the community here to make some posts about how to buy dogecoin. Many of you helped. Thank you! 


There were many posts made by the community and they all have good information in them. Some of these posts have been kept up to date and they are below. 

___

* [The Ultimate Simple Guide for Buying, Trading and Storing Dogecoin ](https://www.reddit.com/r/dogecoin/comments/mso3z0/the_ultimate_simple_guide_for_buying_trading_and/)

___

* [DOGECOIN - How to buy DOGE COIN with cheapest trading fee](https://www.reddit.com/r/dogecoin/comments/l88yrw/dogecoin_how_to_buy_doge_coin_with_cheapest/)
___

* [Simple Crypto Guide - How to buy dogecoin](https://simplecryptoguide.com/how-to-buy-dogecoin/)
___

* [How to buy Dogecoin in 5 easy steps in 5 easy hours](https://www.reddit.com/r/dogecoin/comments/l7np1m/how_to_buy_dogecoin_in_5_easy_steps_in_5_easy/)

___

* [How to Buy/Own Dogecoin: Lowest fees](https://www.reddit.com/r/dogecoin/comments/n0y13z/beginners_guide_how_to_buyown_dogecoin_with_the/)

___

* [How to Purchase Dogecoin in 2021](https://www.reddit.com/r/dogecoin/comments/l7ok46/how_to_purchase_dogecoin_in_2021/) 

___

* [How to buy Dogecoin TODAY](https://www.reddit.com/r/dogecoin/comments/l82jfq/how_to_buy_dogecoin_today/)
___

* [How To Buy DOGECOIN (Simple & Easy) UK,AUST,EUROPE,ASIA](https://www.reddit.com/r/dogecoin/comments/lag3ig/how_to_buy_dogecoin_simple_easy_ukausteuropeasia/)

___

To the moon!

Bonus message - I've allowed referral links to be used in these posts and links even though they are not allowed to be used generally in the subreddit. NEVER listen to financial advice from anyone other than a professional financial advisor! That includes on reddits posts and comments. 

---

Edit: The posts above can be edited any time by the people who wrote them. If you feel there is a serious error or mistake please send modmail and I will remove the post and ask the OP to sort it out.

---

WARNING. Do NOT fall for hype. Don't think you're going to get instantly rich. Don't trust random people offering financial advice. Cryptocurrency is the wild wild west of investing and many people want to take your money and run. You must 'educated' yourself with the good and the bad. You must understand what you're doing.",2442,15713,https://www.reddit.com/r/dogecoin/comments/qrhcs5/how_to_buy_dogecoin/
2025-01-23 01:58:44,DOGECOIN DAILY DISCUSSION,"Hi Shibes.

Welcome to this weeks discussion post. **YOU ARE DOGECOIN!**

If you are looking to safely store your coins for the long term check the links in the ""How to buy DOGECOIN"" post at the top of the subreddit. 

You can get the latest version of the official dogecoin wallet from www.dogecoin.com

---

Here are some links and topics that people have wanted me to post here. Please take a look!

* [HOW TO BUY DOGECOIN GUIDE UPDATED](https://redd.it/qrhcs5/) - https://redd.it/qrhcs5

* [[Guide] How to create and redeem paper wallets! ](https://redd.it/r7cg2e)   

* [[Guide] Extract the recovery phrase from the Android apappp Dogecoin Wallet created by langerhans](https://redd.it/rcvzw4) 

* [[Guide] A quick comparison of Dogecoin wallets](https://redd.it/rd8hya) 

* [Cryptwerk.com is a list of many many many places you can spend dogecoin.](https://cryptwerk.com/pay-with/doge/)

* [Advice from a Gambling Counsellor](https://www.reddit.com/r/dogecoin/comments/mwrltk/advice_from_a_gambling_counsellor/) - https://redd.it/mwrltk

* [Looking after your mental health](https://reddit.com/r/dogecoin/comments/mtf2ym/reminder_that_dogecoin_is_awesome_but_its_not/) - https://redd.it/mtf2ym

* [Being aware of scammers](https://www.reddit.com/r/dogeducation/comments/n9nwfc/scammers/)

* [Another Shibe wrote a post about being aware of scams.](https://redd.it/mrq5c9) - https://redd.it/mrq5c9

* [F@H (Folding@Home) and GitHub are NOT Doge helplines!](https://www.reddit.com/r/dogecoin/comments/n6wtnr/fh_foldinghome_and_github_are_not_doge_helplines/)

* [From 7 years ago. An open letter to the Dogecoin community from co-founder Billy Markus](https://www.reddit.com/r/dogecoin/comments/1xaeue/enjoy_this_moment_an_open_letter_to_the_dogecoin/)

* [Had a few people ask me to mention this petition to get Amazon to accept dogecoin](http://chng.it/R48d6XYwMr)


For more technical discussions about dogecoin please visit /r/dogecoindev 

---


Don't forget to report posts and comments you think are not appropriate for the subreddit. If you want to discuss something specific please [message the moderators](https://www.reddit.com/message/compose/?to=/r/dogecoin)

Do you want something added here? Send the moderators modmail to discuss. Do you want something removed from here? Well send modmail too. You all make this post together and your help is always appreciated. 

You are loved, 

42

___

**D**o **O**nly **G**ood **E**veryday

Just keep on dancing!",11,33,https://www.reddit.com/r/dogecoin/comments/1i7sici/dogecoin_daily_discussion/
2025-02-11 15:06:27,Am I the only one like this?! 😁,,350,17,https://i.redd.it/3u41ofc7ziie1.jpeg
2025-02-11 19:28:08,Bought in the dip,"I did have 2,000 shares a while back but sold so of it. I recently had about 800 shares but when it dropped to $0.25 again, I bought 1,000 shares. ",25,3,https://i.redd.it/z6h9n3e3akie1.jpeg
2025-02-11 12:54:56,The ones who bought at 37 cents per share,"Don’t be disappointed too much

I also regret not selling at 41 ",76,141,https://www.reddit.com/r/dogecoin/comments/1imxwx9/the_ones_who_bought_at_37_cents_per_share/
2025-02-11 05:23:46,Saw this on another sub and thought you guys might like this :),,200,31,https://i.redd.it/bal8oibb3gie1.png
2025-02-11 17:29:14,Dogecoin (DOGE) Records 500 Million Breakthrough…,,21,5,https://i.redd.it/id2bqrlvojie1.jpeg
2025-02-11 18:20:21,Little pumps and massive dumps,,11,29,https://www.reddit.com/r/dogecoin/comments/1in5c1j/little_pumps_and_massive_dumps/
2025-02-11 18:44:56,We hodl doge till the moon,,11,0,https://i.redd.it/0n60k3vd2kie1.jpeg
2025-02-11 13:54:43,Doge ETF inbound,,24,7,https://i.redd.it/7f3mnoslmiie1.jpeg
2025-02-11 17:42:40,Why I believe DOGE is the way:,"🚀 Dogecoin: From Meme to Mainstream Investment 🚀

Investing in Dogecoin (DOGE) isn’t just about jumping on the meme coin bandwagon; it’s about recognizing the potential of a cryptocurrency that’s gained unprecedented traction and utility. Here are compelling reasons why Dogecoin should be in your investment portfolio:

🔹 Institutional Endorsement: Grayscale Investments has taken a significant step by launching the Grayscale Dogecoin Trust, providing a legitimate avenue for both individual and institutional investors to gain exposure to DOGE. This move not only validates Dogecoin’s market presence but also signals a shift towards mainstream acceptance.

🔹 ETF on the Horizon: Multiple asset managers like Bitwise, Rex Shares, and Osprey Funds have filed for a Dogecoin ETF with the SEC. With a speculated approval probability as high as 56%, 2025 might be the year Dogecoin gets its ETF, opening the floodgates for even more investment.

🔹 Market Performance: Despite the volatility inherent to cryptocurrencies, Dogecoin has shown remarkable resilience. Post the ETF filing rumors, DOGE surged from $0.3986 to $0.43, demonstrating the market’s excitement and potential for growth. With the right catalysts, analysts predict Dogecoin could hit its all-time high or even surpass it.

🔹 Global Financial Inclusion: Dogecoin’s low transaction fees and fast transfer times make it an ideal choice for international remittances and microtransactions. It’s not just a currency for the meme community but a tool for financial inclusion, especially in underserved areas.

🔹 Whale Accumulation: Recent data shows significant whale activity with over 560 million DOGE being accumulated in a short span, indicating strong belief from large investors in Dogecoin’s future.

🔹 Community and Culture: The Dogecoin community, known for its philanthropy, humor, and resilience, adds a unique cultural layer to investing. This vibrant community drives adoption and keeps Dogecoin relevant in the crypto space.

🔹 Utility and Adoption: Dogecoin is increasingly accepted by merchants and services worldwide. From payment for goods to tipping content creators, its real-world use cases are expanding.

💡 Why Now? The alignment of regulatory changes, institutional interest, and cultural momentum makes 2025 a pivotal year for Dogecoin. ",10,6,https://www.reddit.com/r/dogecoin/comments/1in4ea0/why_i_believe_doge_is_the_way/
2025-02-11 09:06:31,The calm before the storm,,51,24,https://i.redd.it/8mnehtx67hie1.jpeg
2025-02-10 21:39:54,Spotted in the wild.,,287,11,https://i.redd.it/2nj3z7yosdie1.jpeg
2025-02-11 11:10:40,Your welcome guys. I sold some and it went up 🤣,"I just wanted to buy at a bit of a cheaper price when it went down again. Hoped  for .18 or .20 and of course the one and only time I choose to sell a bit, it wants to go up hahha. I love it here

",20,22,https://www.reddit.com/r/dogecoin/comments/1imw776/your_welcome_guys_i_sold_some_and_it_went_up/
2025-02-11 08:26:54,A weird thing happened to me today.,"
I was doom scrolling through all the Hulu shows, until I saw an old sitcom called Sister Sister. I remember watching this late at night on Nickelodeon with my sister. For reason my intuition told me to watch it.

First two episodes were pretty good and nostalgic. 

3rd episode was when I started to get bored but I watched it through still. 

4th episode…about 6 1/2 minutes into it I grabbed the Xbox controller to change it to something else. 

Right before I pressed B to get out of it.

Thats when I heard it. 

“ can you believe meeting the Doge of Venice?” 

“ did you hear that? She knows the Doge.” 

It’s weird and funny especially with the market sentiment as this year. I’ve had way too many coincidences to think this is just another coincidence. Make your own assumptions on this but I’ve been in this for way too long to press B and get out.

",32,13,https://www.reddit.com/r/dogecoin/comments/1imu0g3/a_weird_thing_happened_to_me_today/
2025-02-11 02:18:03,Doge goes up and down all the time.,,89,5,https://i.redd.it/5cs2tpcb6fie1.jpeg
2025-02-10 17:45:47,I'll keep reposting till we hit the Dollar. Week 196,"I'm posting daily on 'X' for anyone who's interested.. @IsDogeADollar
https://x.com/IsDogeADollar ",429,38,https://i.redd.it/2gds277xmcie1.jpeg
2025-02-11 20:14:03,Look what I found....,,3,0,https://i.redd.it/dutts2aaikie1.jpeg
2025-02-11 06:13:41,Bulls are in control. I tried warning the paper hands,"LFG MY DOGE'S. DO GOOD EVERYDAY & trust the process, it's that simple. https://youtu.be/I-6ZkmzAGQE?si=PlzGnwoQL5xncHP1

Love my fellow DOGE hodler's. Long live Kabosu💛🐕 ",39,9,https://www.reddit.com/r/dogecoin/comments/1ims4wc/bulls_are_in_control_i_tried_warning_the_paper/
2025-02-11 12:43:05,Tell me what this means?,,11,1,https://i.redd.it/31uh8yqt9iie1.png
2025-02-11 05:29:04,DOGEs older Brother LTC is on Fire,Both are mined on the same algorithm SCRYPT. LTC is the 90% favorite to get an ETF soon,36,9,https://www.reddit.com/r/dogecoin/comments/1imrf39/doges_older_brother_ltc_is_on_fire/
2025-02-11 02:01:56,Talk about killing time...,,65,8,https://i.redd.it/nuclijnf3fie1.jpeg
2025-02-11 20:14:15,Just bought another dip.,,2,0,https://i.redd.it/9jqsjcbbikie1.jpeg
2025-02-11 06:52:28,Here we go!,I hope y’all took advantage of the dip; we’re going to the moon!,21,23,https://www.reddit.com/r/dogecoin/comments/1imspw1/here_we_go/
2025-02-11 15:29:09,House on the right gonna go be complete and then boom on Friday.,,3,7,https://i.redd.it/yduu8vfg3jie1.jpeg
2025-02-11 08:30:38,This is what ChatGPT thinks!,,14,12,https://i.redd.it/703hv0fs0hie1.jpeg
2025-02-10 18:10:33,I'm not selling we're going to the moon.,,192,25,https://i.redd.it/3mh49y9crcie1.jpeg
2025-02-11 18:33:12,My opinion on the pattern forming on the chart.,"So I posted in the morning that the pattern looks like a lil house forming. Although, it went diagonally up a bit more… now it’s coming down. If yall see the pattern on the weekly chart, yall gonna see a bunch of ‘lil house shapes’ coming down from the left and towards right up. That’s all I’m saying, I may not be an expert but the lil cup is forming, might go up or down? Who knows. For now it looks like a (_) shape might be forming. Meaning an up in the next days. Or couple weeks.",2,4,https://www.reddit.com/r/dogecoin/comments/1in5nbu/my_opinion_on_the_pattern_forming_on_the_chart/
2025-02-11 04:47:11,Dogecoin has a lot of ETF potential.,"https://preview.redd.it/p75swl32xfie1.jpg?width=670&format=pjpg&auto=webp&s=7dd98239a63c06829235978713f3c0dd8c73c0dc

    
    Hold on. There are many possibilities.",19,5,https://www.reddit.com/r/dogecoin/comments/1imqp70/dogecoin_has_a_lot_of_etf_potential/
2025-02-10 19:12:08,Just have to lower our expectations for now 😄,,83,13,https://i.redd.it/s7mxkhsb2die1.jpeg
2025-02-10 14:26:35,Dogecoin holders,,207,27,https://i.redd.it/q1lw98qdnbie1.jpeg
2025-02-11 03:13:08,To the moon!!,,20,3,https://i.redd.it/ad0tm2t4gfie1.jpeg
2025-02-11 18:49:33,Where are the happy success stories?,Who bought incrementally while bobbling around .10 and sold in the .30 range and is wisely investing to level up their life? ,0,2,https://www.reddit.com/r/dogecoin/comments/1in61rt/where_are_the_happy_success_stories/
2025-02-11 02:47:13,"Since people liked my previous chart prediction, here’s another one. Just my opinion based on pattern.",,19,25,https://www.reddit.com/gallery/1imofda
2025-02-11 18:00:03,Bought a Tangem card wallet,Curious to see where everyone is holding their doge/other crypto? Finally got myself a hardware wallet(Tangem card wallet). Remember not your key not your crypto! ,1,11,https://www.reddit.com/r/dogecoin/comments/1in4tj9/bought_a_tangem_card_wallet/
2025-02-11 17:28:17,beatufil day to the king 🐻🐻🐻❤️,"but in 0,15 🐻 will be happy ❤️🐻🐻",1,1,https://www.reddit.com/r/dogecoin/comments/1in41dp/beatufil_day_to_the_king/
2025-02-11 00:18:22,People are waiting for their tax returns. Think about what that means when they get them for the market as a whole. HODL,/\\,22,30,https://www.reddit.com/r/dogecoin/comments/1imlj62/people_are_waiting_for_their_tax_returns_think/
2025-02-11 03:11:23,It’s that PAMP IT guy haha,,13,4,https://i.redd.it/qh2al7gtffie1.jpeg
2025-02-11 02:11:59,Possible price reversal?,,13,0,https://i.redd.it/fduqphf85fie1.jpeg
2025-02-10 17:13:05,All aboard the doge train say aye,,70,32,https://www.reddit.com/r/dogecoin/comments/1imb919/all_aboard_the_doge_train_say_aye/
2025-02-10 10:51:45,Wow doge is back into number 3# in crypto for reddit !! LFG for the people dogecoin!!!,,225,15,https://i.redd.it/125azjx1laie1.jpeg
2025-02-11 17:15:50,Can everyone stop selling there doge!!!,,0,36,https://www.reddit.com/r/dogecoin/comments/1in3qig/can_everyone_stop_selling_there_doge/
2025-02-10 17:03:20,Anyone Buying at .25?,"Of course I bought at .37 before it dropped, so contemplating .25 as a strong buy opportunity. Anyone else buying right now? ",40,56,https://www.reddit.com/r/dogecoin/comments/1imb046/anyone_buying_at_25/
2025-02-10 11:20:33,A good investment - time is money!,,99,2,https://i.redd.it/x2wb1hv3qaie1.jpeg
2025-02-09 21:54:19,Thanks Doge,,1031,58,https://i.redd.it/e9ws8zmcq6ie1.jpeg
2025-02-10 18:34:46,Next couple of months shall be interesting,"A lot of talk and speculation to replace the penny, Dogecoin ETF, and Dogecoin being used for payments. Where can this go IF it happens? Just asking for a discussion, I’m holding no matter what happens ✊🏼",17,19,https://www.reddit.com/r/dogecoin/comments/1imdb0d/next_couple_of_months_shall_be_interesting/
2025-02-11 03:31:09,DOUGH wallet Resurrection for my DogeCoins,Many **moons** ago I had a Doge stack in a mobile wallet called DOUGH. It is long defunct but I still have my 12 word seed. What is an *easy/trustworthy* way to recover this well aged DOGE...,4,4,https://www.reddit.com/r/dogecoin/comments/1impatn/dough_wallet_resurrection_for_my_dogecoins/
2025-02-11 00:38:19,Darling comrades. Who can tell about different doge faucet !??,Recently I found some information about the possibilities of getting DOGE for completing tasks on various sites. Who has encountered this? Please share your experience.,5,3,https://www.reddit.com/r/dogecoin/comments/1imlyai/darling_comrades_who_can_tell_about_different/
2025-02-10 17:04:06,To the moon,Here we go!,17,9,https://www.reddit.com/r/dogecoin/comments/1imb0td/to_the_moon/
2025-02-10 09:21:15,I like my version better....🤷,,74,5,https://i.redd.it/zw0ixcnw4aie1.jpeg
2025-02-11 00:33:44,Gonna go more up or down?. So far tariffs didn’t affect the euro market. SO FAR…,,6,1,https://www.reddit.com/r/dogecoin/comments/1imluva/gonna_go_more_up_or_down_so_far_tariffs_didnt/
2025-02-10 23:14:16,The Dogecoin community right now.,,6,1,https://i.redd.it/6aac5wyi9eie1.jpeg
2025-02-10 18:24:39,The news is just opinions...,Just trying to see some DOGE news and this is what you get. Contradicting information and pure speculation. Just Do Good Every Day...,12,9,https://i.redd.it/fe6f12uutcie1.jpeg
2025-02-11 17:29:04,Doge Might’ve Killed Its Own Moonshot… Just My Take,"People keep saying “Be patient, Doge will moon!” but they’re ignoring a huge red flag. Doge is now politically linked, and historically, anything tied to a political party **never** takes off long-term. Once a product becomes a symbol of one side, it alienates the other half of the market. Worse, when the political hype dies down (and it always does lmfao), the product crashes and burns.

Crypto thrives on **widespread adoption**, not political branding. Doge isn’t just a meme anymore; it’s a statement. And that’s the fastest way to kill its chances of real, sustainable growth.

Also screenshots of old Doge buys of mine **4 YEARS AGO**",0,15,https://www.reddit.com/gallery/1in4254
2025-02-10 19:08:18,DOGE TO THE MOON!!,,11,5,https://www.reddit.com/r/dogecoin/comments/1ime5ma/doge_to_the_moon/
2025-02-10 06:47:46,Wake me up when is 99 cents !,,95,39,https://www.reddit.com/r/dogecoin/comments/1im041j/wake_me_up_when_is_99_cents/
2025-02-10 21:48:24,What do you guys actually think the forecast of Dogecoin is for this year,"I'm not planning on selling till I turn a decent profit, but I was just wondering what you all think is the forecast for Dogecoin. I've been reading the news and some are saying $0.06 and others are saying $8.00, so idk what to think",7,58,https://www.reddit.com/r/dogecoin/comments/1imi4ff/what_do_you_guys_actually_think_the_forecast_of/
2025-02-10 14:02:30,Looking good this morning with a big wave coming up,Let’s see what happens ,23,56,https://i.redd.it/pwa310z2jbie1.jpeg
2025-02-10 22:44:37,Thoughts about SEC Filings?,"SEC updates set for this friday. Litecoin and Dogecoin at the rop of the list. 90 % and 75 % respectively. 


Thoughts??",6,6,https://www.reddit.com/r/dogecoin/comments/1imjgwt/thoughts_about_sec_filings/
2025-02-10 22:04:59,"Doge, will you be my valentine?",,6,3,https://www.reddit.com/r/dogecoin/comments/1imij43/doge_will_you_be_my_valentine/
2025-02-10 09:01:37,who doing the same think ?,,47,5,https://i.redd.it/q99rczkb1aie1.jpeg
2025-02-10 04:16:19,"Here's your reminder, now stop crying!",,110,16,https://i.redd.it/8am0iw6im8ie1.png
2025-02-09 20:57:37,The anticipation is killing me,,336,52,https://i.redd.it/ty6ouuh8g6ie1.jpeg
2025-02-11 03:27:38,are ASIC's the only way to go for any profits?,New to mining but Eager to learn about hardware and software anyone have any places for info on mining ,0,8,https://www.reddit.com/r/dogecoin/comments/1imp8dk/are_asics_the_only_way_to_go_for_any_profits/
2025-02-09 22:17:59,Same ocean! 🤣,,102,11,https://i.redd.it/40m60mmku6ie1.jpeg
2025-02-10 01:57:15,I'll just leave this here as hope for the people all the way up there,,46,20,https://i.redd.it/dyeg4p0px7ie1.png
2025-02-10 01:03:51,enjoy doge 🌕,"remember why you joined the dogecoin community in the first place. doge is a great community for the people. I personally joined the community because I know doges potential, like the ecosystem, and who doesn’t love dogs/ a doge. enjoy the ups and downs, and one day everything will pay off 🚀diamond hands to the moon 💎",38,18,https://www.reddit.com/r/dogecoin/comments/1ilu9c6/enjoy_doge/
2025-02-09 15:56:41,My friend,,200,5,https://i.redd.it/nb7xeiljy4ie1.jpeg
2025-02-09 16:37:42,I will keep on posting this until we get through this fiasco triumphantly. There is only one true DOGE. Do Only Good Everyday!,RT,155,42,https://www.reddit.com/r/dogecoin/comments/1ilirc9/i_will_keep_on_posting_this_until_we_get_through/
2025-02-10 01:51:23,What are your pets called? mine is called Benji 🥰,,24,9,https://i.redd.it/3yu8cl6nw7ie1.jpeg
2025-02-10 08:27:25,"New to trading, advices ?",I’m new to trading and I could need some advices.,9,7,https://www.reddit.com/r/dogecoin/comments/1im1gml/new_to_trading_advices/
2025-02-10 07:40:43,Hey I'm new to cryto and have some questions,So I have a hundred (might do $250) and I wanna invest it and wondering if I should dump it all into doge or dump some into doge and maybe some of it else where? ,7,9,https://www.reddit.com/r/dogecoin/comments/1im0upy/hey_im_new_to_cryto_and_have_some_questions/
2025-02-10 08:51:18,its just happend to me all the time?,"https://preview.redd.it/tjxle2chz9ie1.jpg?width=193&format=pjpg&auto=webp&s=8d7eb9aa9954834fcd151493719cd1df47e8957b

",5,2,https://www.reddit.com/r/dogecoin/comments/1im1rn3/its_just_happend_to_me_all_the_time/
2025-02-09 17:04:35,MARK MY WORD : Dogecoin will hit 1$ in the next 18 month.,You read it first 🐌,105,292,https://www.reddit.com/r/dogecoin/comments/1iljeqg/mark_my_word_dogecoin_will_hit_1_in_the_next_18/
2025-02-10 08:58:44,I need some help recovering from Dough wallet \ Dogecoin wallet \ Toast wallet!,"Hey guys,

Back in 2017 I used to trade some crypto, most of the tokens were Dogecoin. Thesedays I found my old notebook in which I wrote all the phrases and passwords of my wallets, Yet when I tried to log on to them - I found out that most of them aren't working anymore.

Is there a way to recover my coins from wallets like Doughwallet \\ Dogecoin wallet \\ Toast wallet? All I have is the 12 words I got when I opened it.

Thanks alot!",7,1,https://www.reddit.com/r/dogecoin/comments/1im1v6g/i_need_some_help_recovering_from_dough_wallet/
2025-02-09 19:33:11,3D printed a tiny Lil doge,Smol Boi ,56,5,https://www.reddit.com/gallery/1iln01b
2025-02-10 13:08:51,One way to go🥂,Shout out to all my doge’s.🐕🥂,2,7,https://www.reddit.com/r/dogecoin/comments/1im5pix/one_way_to_go/
2025-02-09 16:27:46,we will bring it back,,83,8,https://i.redd.it/5iouixa345ie1.jpeg
2025-02-10 08:24:21,They not like us,They not like us.  Soon everyone will accept doge.  Soon we will be the proof of work behind the US Treasury.  ,4,1,https://i.redd.it/j59oqh0ru9ie1.jpeg
2025-02-11 01:37:43,I just sold all my doge,It's gonna explode to the moon i bet ...,0,64,https://www.reddit.com/r/dogecoin/comments/1imn5w1/i_just_sold_all_my_doge/
2025-02-10 18:20:45,Eyy can someone of y’all  invest a billon dollar in doge?,I need a new toilet seat ,0,3,https://www.reddit.com/r/dogecoin/comments/1imcy9p/eyy_can_someone_of_yall_invest_a_billon_dollar_in/
2025-02-09 02:12:24,Is this the end?,Buy the dip and finish hard,770,369,https://i.redd.it/k6949dhhv0ie1.jpeg
2025-02-10 01:50:11,Just added a little extra to the bag! 🍿🤌🏼,Dipping it down for a big scoop!,9,1,https://www.reddit.com/r/dogecoin/comments/1ilv2d9/just_added_a_little_extra_to_the_bag/
2025-02-10 00:26:17,Do Only Good Everyday,"Hello, I'm new here and I've seen a lot of posts about what Doge has become, could you tell me more about what Doge is to you? I see people posting things like ""Do Only Good Everyday"", was that DOGE's slogan or something like that? Good luck with your investment, at the moment I only have $5 in DOGE, I plan to put $100 in by the end of the year.",11,8,https://www.reddit.com/r/dogecoin/comments/1iltjlt/do_only_good_everyday/
2025-02-09 23:29:58,I Built a Dogecoin-Powered Pinball Machine,,14,2,https://blog.ifdogethenwow.com/posts/my-pinball-machine-accepts-dogecoin/
2025-02-09 18:39:42,It's calm. Too calm. Get ready...,,29,40,https://www.reddit.com/r/dogecoin/comments/1illos2/its_calm_too_calm_get_ready/
2025-02-10 02:27:26,crunched some numbers,"https://preview.redd.it/knapf9tl78ie1.png?width=910&format=png&auto=webp&s=b5ecd51318360bb3c8a759fd2221078b3f6daf54

",7,2,https://www.reddit.com/r/dogecoin/comments/1ilvohl/crunched_some_numbers/
2025-02-10 01:02:45,PSA: Dont forget to backup,"Hello, today I've found out I've lost access to my wallet due to disk failure. That means I've lost 33 DOGE (such crazy amount, I'll probably go bankrupt) because I forgot to do a proper backup of my wallet.

Dont wait around to find out kids, do your backups!",7,9,https://www.reddit.com/r/dogecoin/comments/1ilu8kz/psa_dont_forget_to_backup/
2025-02-09 22:50:55,You need to Zoom out!,"Yes, it is hard to see nearly 50% drop from back in December but it ain’t over yet. Look where we were in August. ",7,7,https://i.redd.it/ljg030kf07ie1.jpeg
2025-02-09 00:31:10,You can't keep a good dog down,,401,32,https://i.redd.it/iqi6r369d0ie1.png
2025-02-10 18:15:13,No for real now no playin.,Here we go!! 15% ,0,15,https://www.reddit.com/r/dogecoin/comments/1imctal/no_for_real_now_no_playin/
